<?xml version = "1.0" encoding = "UTF-8"?>
<shipping_costs xmlns:xsi = "http://www.w3.org/2001/XMLSchema-instance" xsi:noNamespaceSchemaLocation = "BW_shipping_costs.xsd">  
	<destination>
		<region>USA</region>
		<costs>  
			<max_purchase_price>50</max_purchase_price>  
			<shipping_total>20</shipping_total>
		</costs>
		<costs>  
			<max_purchase_price>250</max_purchase_price>  
			<shipping_total>40</shipping_total>
		</costs>
		<costs>  
			<max_purchase_price>500</max_purchase_price>  
			<shipping_total>60</shipping_total>
		</costs>  
	</destination>  
	<destination>
		<region>EMEA</region>
		<costs>  
			<max_purchase_price>50</max_purchase_price>  
			<shipping_total>60</shipping_total>
		</costs>
		<costs>  
			<max_purchase_price>250</max_purchase_price>  
			<shipping_total>80</shipping_total>
		</costs>
		<costs>  
			<max_purchase_price>500</max_purchase_price>  
			<shipping_total>100</shipping_total>
		</costs>  
	</destination>  
	<destination>
		<region>Australasia</region>
		<costs>  
			<max_purchase_price>50</max_purchase_price>  
			<shipping_total>60</shipping_total>
		</costs>
		<costs>  
			<max_purchase_price>250</max_purchase_price>  
			<shipping_total>80</shipping_total>
		</costs>
		<costs>  
			<max_purchase_price>500</max_purchase_price>  
			<shipping_total>100</shipping_total>
		</costs>  
	</destination>  
	<destination>
		<region>Americas</region>
		<costs>  
			<max_purchase_price>50</max_purchase_price>  
			<shipping_total>60</shipping_total>
		</costs>
		<costs>  
			<max_purchase_price>250</max_purchase_price>  
			<shipping_total>80</shipping_total>
		</costs>
		<costs>  
			<max_purchase_price>500</max_purchase_price>  
			<shipping_total>100</shipping_total>
		</costs>  
	</destination>
</shipping_costs>